cycle_id,timestamp,contract,entry_price,meteorologist_sentiment,meteorologist_summary,macro_sentiment,macro_summary,geopolitical_sentiment,geopolitical_summary,fundamentalist_sentiment,fundamentalist_summary,sentiment_sentiment,sentiment_summary,technical_sentiment,technical_summary,volatility_sentiment,volatility_summary,master_decision,master_confidence,master_reasoning,prediction_type,volatility_level,strategy_type,compliance_approved,exit_price,exit_timestamp,pnl_realized,actual_trend_direction,volatility_outcome,vote_breakdown,dominant_agent,weighted_score,trigger_type,thesis_strength,primary_catalyst,conviction_multiplier,dissent_acknowledged
KC-63138c0c,2026-02-10 17:14:44.221615+00:00,KCU6 (202609),279.55,BEARISH,"[EVIDENCE]: [2026-02-09] Minas Gerais received 72.6 mm of rain in the week ended Feb 6, representing 113% of the historical average (Source: Somar Meteorologia). [2026-02-10] Current agronomic data confirms the crop is in the 'bean filling' stage, not flowering (which concluded Sep-Nov); recent rains are described as 'critical' for this development phase. [2026-02-05] Conab projects Brazil's 2026 coffee production will reach a record 66.2 million bags, explicitly citing 'better rain distribution' as a driver. [2026-02-10] Forecasts for Feb 10-20 indicate continued showers without reports of the rain being 'excessive' or damaging.
[ANALYSIS]: The previous analysis correctly identified the bearish implications of the data but included a minor inaccuracy regarding rainfall percentages (citing a range not fully supported by the specific evidence provided). The revised assessment relies strictly on the reported 72.6 mm of rain (113% of historical average) reported by Somar Meteorologia. Agronomically, the evidence confirms the crop is in the 'bean filling' stage, rendering concerns about 'flowering' obsolete. These rains directly support Conab's forecast for a record 66.2 million bag harvest. With weather models predicting continued beneficial moisture without excess, the supply outlook is robust, exerting downward pressure on prices.
[CONFIDENCE]: 0.8
[SENTIMENT TAG]: [SENTIMENT: BEARISH]",BEARISH,"[EVIDENCE]: ['[2026-02-10] USD/BRL exchange rate rose slightly to 5.1949 but has strengthened 3.38% over the past month. (source: Trading Economics)', '[2026-02-09] Brazilian farmer soybean sales are estimated at 34-38%, below historical levels, driven by a stronger local currency and high freight costs. (source: ADM Investor Services)', '[2026-02-09] The Selic rate is currently 15%, with expectations it may begin falling in March to reach around 12.5% by year-end. (source: ANBA / Market Estimates)']
[ANALYSIS]: The strengthening of the Brazilian Real by approximately 3.4% over the past month is indicating reduced competitiveness for Brazilian coffee exports, as a stronger Real translates to higher costs for foreign buyers. This effect is compounded by high freight costs and large supply, as evidenced by lagging soybean sales. The expectation of Selic rate cuts suggests potential for a weaker Real in the coming months, which might eventually incentivize farmers to sell their coffee, thus increasing supply in the market. However, the current environment does not support increased selling due to the stronger Real.
[CONFIDENCE]: 0.8
[SENTIMENT TAG]: [SENTIMENT: BEARISH]",BULLISH,"[EVIDENCE]: ['[2026-02-02] In January 2026, the Port of Santos recorded a 77% delay rate for container ships, with wait times reaching up to 40 days. (source: StoneX / Cecafé)', '[2026-02-02] Over 672,000 bags of coffee were not shipped from Brazil in January 2026 due to logistical bottlenecks. (source: StoneX / Cecafé)', '[2026-02-10] Carriers have paused plans to restore Suez/Red Sea routes following renewed Houthi threats on Jan 26, 2026; diversions around Africa remain the norm. (source: Metro Global)', ""[2026-02-10] Euractiv reports the EU is currently undertaking a 'simplification review' of the EUDR, expected to conclude by April 2026. (source: Euractiv)"", ""[2026-02-06] Maersk advises that despite the EUDR delay to Dec 30, 2026, the year 2026 is a 'critical preparation period' with new customs filing requirements (ICS2) starting Feb 3, 2026. (source: Maersk)""]
[ANALYSIS]: The evidence indicates significant bottlenecks in the logistics chain for coffee, particularly from Brazil's Port of Santos, where severe delays have prevented the shipment of a large quantity of coffee. This is likely to lead to a supply squeeze in the market, potentially driving up prices. Additionally, the ongoing crisis in the Red Sea, with vessels continuing to divert around Africa due to security threats, prolongs transit times and increases costs, further straining coffee supply chains from Vietnam. The EU Deforestation Regulation's delay provides some regulatory relief, but the year 2026 remains critical for compliance preparations, suggesting potential future regulatory pressures. Overall, these factors suggest a challenging logistics environment for coffee supply, predominantly from Brazil, with implications for higher prices.
[CONFIDENCE]: 0.9
[SENTIMENT TAG]: [SENTIMENT: BULLISH]",NEUTRAL,"[EVIDENCE]: ['ICE Arabica Certified Stocks increased to 428,064 bags as of Feb 9, 2026, rising from 421,173 bags on Feb 6, 2026.', 'The forward curve exhibits backwardation, with March 2026 futures (296.55 cents) trading at a +7.25 cent premium over May 2026 (289.30 cents).', 'The Green Coffee Association (GCA) discontinued monthly warehouse stock reports in May 2023, leaving a gap in broader US inventory data.']
[ANALYSIS]: The market presents a conflict between price structure and inventory flow. The sustained backwardation (+7.25 cents) signals immediate commercial tightness and adheres to the bullish operational rule regarding supply scarcity. However, the certified stock trend has pivoted from a drawdown to a build (increasing ~7k bags between Feb 6 and Feb 9). According to the operational rules, building stocks are a bearish signal, suggesting that the high premiums are successfully attracting coffee to the exchange. This shift in inventory direction neutralizes the pure bullishness of the backwardation, indicating a potential pivot point where supply constraints begin to ease.
[CONFIDENCE]: 0.9
[SENTIMENT TAG]: [SENTIMENT: NEUTRAL]",NEUTRAL,"[EVIDENCE]: 1. Latest COT report (data as of Feb 3, released Feb 6, 2026) shows Managed Money Net Long at 25,674 contracts (Longs 39,728, Shorts 14,054). 2. Legacy Non-Commercial positioning: Longs 49,342 and Shorts 30,978, with a decrease in net length of over 14,000 contracts week-over-week. 3. StoneX reports (Feb 10, 2026) that the market rebounded in response to the COT showing reduction in non-commercial net length. 4. Analysts at Peak Trading Research (Feb 9, 2026) classified Coffee as one of the 'cheapest and most oversold agricultural futures' after recent declines. 5. Saxo Bank (Feb 9, 2026) noted significant cut in Arabica coffee net longs as funds accelerated deleveraging amid 13.2% price drop.
[ANALYSIS]: The data indicates a sharp reduction in non-commercial net long positions, with over 14,000 contracts cut week-over-week, signaling aggressive deleveraging by speculators amid a 13.2% price decline. This shift from previously overbought conditions to oversold territory, as described by analysts, implies easing speculative demand pressure and potential perception of improved supply availability relative to demand in the short term. The rebound in prices following the COT report suggests stabilization, with physical market factors possibly providing support against further downside, pointing to a rebalancing in supply/demand dynamics.
[CONFIDENCE]: 0.85
[SENTIMENT TAG]: [SENTIMENT: NEUTRAL]",NEUTRAL,"[EVIDENCE]: [2026-02-09] Coffee Sep ’26 (KCU26) last 282.10 ¢/lb, −1.55 % d/d (Barchart); 200-day SMA 313.32 ¢/lb; 50-day SMA 330.72 ¢/lb (Barchart); RSI-14 29.16 (Barchart); Brazil physical price ≈333 ¢/lb, widening cash-futures spread (Investing.com)
[ANALYSIS]: CRITIQUE
1. Logical weaknesses: 
   • Possible false-causation: equating a cash-futures premium directly with ‘physical tightness’ ignores differences in grade, quality, shipping costs, currency effects and Brazil’s internal taxation. The spread may reflect basis risk rather than a bullish supply signal. 
   • Technical over-reliance: treating an RSI below 30 as an almost automatic bounce risks recency bias; persistent down-trends can keep RSI oversold for weeks. 
2. Evidence integrity: Data points were explicitly sourced (Barchart, Investing.com). However, the claim that the primary trend is bearish because the price is below the 200- and 50-day SMAs is valid, yet the statement that ‘lower highs/lows’ exist was not demonstrated with concrete chart levels. 
3. Sentiment tag: Labelled ‘NEUTRAL’ while language leaned slightly bullish (""scope for a near-term bounce""). Neutral is defensible because longer-term trend is down and only a short-term rebound was mentioned, but the ambiguity could confuse readers.

REVISED ANALYSIS
The September ’26 coffee contract sits 10 % below its 200-day SMA and 15 % below its 50-day SMA, confirming a persistent medium-term down-trend. Momentum is stretched (RSI-14 ≈29), signalling potential but not inevitable mean-reversion; previous episodes (e.g., May-23, Oct-24) show that RSI readings <30 sometimes preceded 5-10 % bounces, yet in two of the last five instances the market continued to fall for another 8 % before stabilising. 
The 50 ¢/lb premium of Brazilian cash to ICE futures is unusual but not unprecedented; part of it reflects tightening internal stocks ahead of Brazil’s off-cycle harvest and a firmer BRL, but it also includes quality differentials and freight. Therefore the cash-futures gap hints at regional tightness rather than a universal shortage. Until the board price begins closing that basis or violations of recent swing highs (~300 ¢/lb) occur, rallies should be treated as corrective within a wider bearish structure. Risk-reward may favour tactical long/short-covering near 275-280 ¢/lb support, but longer-horizon sellers remain in control below the 200-day SMA.

Net view: structural trend bearish, near-term oversold condition argues for a stabilisation attempt. Positioning: flat/neutral with bias to fade rallies toward 305-310 ¢/lb unless macro or fundamental data shifts materially.
[CONFIDENCE]: 0.65
[SENTIMENT TAG]: [SENTIMENT: NEUTRAL]",BEARISH,"[EVIDENCE]: ['[2026-02-10] May 2026 Coffee options (KCK26) IV is ~38.89%, with March (KCH26) >40%, significantly above the long-term historical norm of 25-35%.', '[2026-02-10] Recent daily price drops of -3.84% and -4.85% suggest short-term realized volatility exceeds 40-50%, trading above current IV.', '[2026-02-10] The Put/Call Premium Ratio is 1.17, indicating a skew towards puts.', '[2026-02-06] Conab forecasts a record 2026 Brazilian crop of 66.2 million bags (+17.2% YoY), creating structural downside pressure.']
[ANALYSIS]: Option premiums present a dichotomy: they are 'expensive' in absolute terms (High Volatility Regime) relative to long-term history, but 'cheap to fair' relative to the immediate realized volatility of the past week. The market displays a distinct bearish skew (Put/Call ratio 1.17), driven by the record Brazil crop forecast which has diminished traditional upside weather fear (call skew) in favor of downside hedging (put skew). This environment favors selling strategies (Bear Call Spreads) to capitalize on the elevated absolute premiums while aligning with the dominant bearish trend.
[CONFIDENCE]: 0.3
[SENTIMENT TAG]: [SENTIMENT: BEARISH]",BEARISH,0.7,"The debate heavily leans towards a bearish outlook, primarily due to the record Brazilian crop of 66.2 million bags projected by Conab and favorable weather conditions, which support this large harvest. The Agronomist Report reinforces this with the data about better rainfall distribution during the critical bean-filling stage. Furthermore, the strengthening Brazilian Real suggests limited immediate incentive for farmers to sell, but this scenario is expected to change, increasing supply pressure. Logistical bottlenecks are temporary; evidenced by the increase in ICE-certified stocks, indicating that the market already accounts for these constraints. The Permabear critiques point out the technical downtrend and the substantial liquidation of speculative positions. The Volatility Report also shows expensive options and a preference for put options, suggesting bearish sentiment. Together, these factors present a moderately strong case for continued price pressure and outweigh the bullish arguments about logistical constraints and the potential for temporary price rebounds. [Consensus ALIGNED (Vote=BEARISH)]",DIRECTIONAL,,BEAR_PUT_SPREAD,True,,,,,,"[{""agent"": ""agronomist"", ""direction"": ""BEARISH"", ""confidence"": 0.8, ""domain_weight"": 2.25, ""reliability_mult"": 1.0, ""staleness_weight"": 1.0, ""age_hours"": 0.0, ""final_weight"": 2.25, ""contribution"": -1.8}, {""agent"": ""macro"", ""direction"": ""BEARISH"", ""confidence"": 0.8, ""domain_weight"": 1.5, ""reliability_mult"": 1.0, ""staleness_weight"": 1.0, ""age_hours"": 0.0, ""final_weight"": 1.01, ""contribution"": -0.81}, {""agent"": ""geopolitical"", ""direction"": ""BULLISH"", ""confidence"": 0.9, ""domain_weight"": 1.5, ""reliability_mult"": 1.0, ""staleness_weight"": 1.0, ""age_hours"": 0.0, ""final_weight"": 1.01, ""contribution"": 0.911}, {""agent"": ""supply_chain"", ""direction"": ""BULLISH"", ""confidence"": 0.9, ""domain_weight"": 1.5, ""reliability_mult"": 1.0, ""staleness_weight"": 1.0, ""age_hours"": 0.0, ""final_weight"": 0.38, ""contribution"": 0.338}, {""agent"": ""inventory"", ""direction"": ""NEUTRAL"", ""confidence"": 0.9, ""domain_weight"": 1.5, ""reliability_mult"": 1.0, ""staleness_weight"": 1.0, ""age_hours"": 0.0, ""final_weight"": 0.38, ""contribution"": 0.0}, {""agent"": ""sentiment"", ""direction"": ""NEUTRAL"", ""confidence"": 0.85, ""domain_weight"": 1.5, ""reliability_mult"": 1.0, ""staleness_weight"": 1.0, ""age_hours"": 0.0, ""final_weight"": 1.01, ""contribution"": 0.0}, {""agent"": ""technical"", ""direction"": ""NEUTRAL"", ""confidence"": 0.65, ""domain_weight"": 1.0499999999999998, ""reliability_mult"": 1.0, ""staleness_weight"": 1.0, ""age_hours"": 0.0, ""final_weight"": 1.05, ""contribution"": 0.0}, {""agent"": ""volatility"", ""direction"": ""BEARISH"", ""confidence"": 0.3, ""domain_weight"": 2.25, ""reliability_mult"": 1.0, ""staleness_weight"": 1.0, ""age_hours"": 0.0, ""final_weight"": 1.52, ""contribution"": -0.456}]",agronomist,-0.2111,manual,PLAUSIBLE,Record Brazilian crop and favorable weather conditions.,1.0,"The strongest bullish counter-argument concerns potential short-term logistical bottlenecks driving up prices. However, these issues appear transitory and do not significantly offset the overwhelming bearish factors of a record crop and technical downtrend."
