cycle_id,timestamp,contract,entry_price,meteorologist_sentiment,meteorologist_summary,macro_sentiment,macro_summary,geopolitical_sentiment,geopolitical_summary,fundamentalist_sentiment,fundamentalist_summary,sentiment_sentiment,sentiment_summary,technical_sentiment,technical_summary,volatility_sentiment,volatility_summary,master_decision,master_confidence,master_reasoning,prediction_type,volatility_level,strategy_type,compliance_approved,exit_price,exit_timestamp,pnl_realized,actual_trend_direction,volatility_outcome,vote_breakdown,dominant_agent,weighted_score,trigger_type,thesis_strength,primary_catalyst,conviction_multiplier,dissent_acknowledged
KC-d1712117,2026-02-11 14:09:19.179541+00:00,KCU6 (202609),284.05,BEARISH,"[EVIDENCE]: [2026-02-11] Forecasts predict steady rains and thunderstorms for Minas Gerais over the next 10 days (Source: Weather Crave / AccuWeather). [2026-02-03] Minas Gerais received 69.8 mm of rain in the week ended Jan 30, representing 117% of the historical average (Source: Somar Meteorologia). [2026-02-11] Agronomic data confirms the crop is currently in the 'bean-filling' stage, not flowering; rains are described as 'highly beneficial' for recovery (Source: Raw Research Findings). [2026-02-06] Conab projects a record 2026 harvest of 66.2 million bags, explicitly citing favorable weather conditions (Source: Conab).
[ANALYSIS]: Meteorological data from Somar confirms Minas Gerais received 69.8 mm of rainfall (117% of historical average), with forecasts indicating continued precipitation. Crucially, agronomic evidence clarifies the crop is in the 'bean-filling' stage rather than flowering; consequently, this moisture is optimizing bean density and recovery rather than damaging blossoms. These conditions directly validate Conab's projection for a record 66.2 million bag harvest in 2026. The convergence of record production estimates with weather patterns that enhance yield potential creates a robust supply surplus outlook, weighing negatively on price expectations.
[CONFIDENCE]: 0.8
[SENTIMENT TAG]: [SENTIMENT: BEARISH]",BEARISH,"[EVIDENCE]: 1. [2026-02-11] The USD/BRL exchange rate is trading at approximately 5.19-5.20, actively testing its strongest levels since May 2024. (source: Trading Economics / DailyForex), 2. [2026-02-11] Brazilian farmers are selling the 2025/26 soybean crop at a slower pace than usual (approx. 34-38% sold), discouraged by the strengthening BRL. (source: Agrolatam / UkrAgroConsult), 3. [2026-02-10] Brazil's Central Bank maintained the Selic rate at 15.00% but signaled that interest rate cuts could begin in March 2026. (source: Reuters / Investing.com), 4. [2026-02-10] Annual inflation in Brazil rose to 4.44% in January 2026, remaining within the target range but keeping the central bank cautious. (source: Trading Economics)
[ANALYSIS]: The evidence suggests that the Brazilian Real is currently strong against the US dollar, with the USD/BRL exchange rate at approximately 5.19-5.20. This strength may be contributing to slower crop sales by Brazilian farmers, particularly for the soybean crop, as the exchange rate affects their returns in local currency. The strong Real could also pose challenges for Brazilian exports, as it makes products like coffee more expensive on the global market. High interest rates maintained by the Central Bank are another factor keeping costs high, which could deter immediate sales. The indication of possible interest rate cuts starting in March 2026 could influence the exchange rate and potentially weaken the Real, which might improve export conditions if realized. However, the analysis assumes a direct correlation between interest rate policy and currency value without accounting for other intervening economic factors. Additionally, while the sentiment is tagged as BEARISH due to current conditions, the potential for interest rate cuts offers a more nuanced outlook. Overall, the analysis may overlook short-term versus long-term impacts and could benefit from considering broader economic variables.
[CONFIDENCE]: 0.65
[SENTIMENT TAG]: [SENTIMENT: BEARISH]",BULLISH,"[EVIDENCE]: The evidence indicates significant logistical bottlenecks in the coffee supply chain, specifically focusing on the Port of Santos in Brazil, Red Sea shipping diversions, increased freight costs, and a potential increase in Brazil's coffee output. Additionally, there is potential regulatory relief through planned tweaks to the EUDR.
[ANALYSIS]: The analysis identifies multiple contributing factors that could affect the coffee supply chain. The severe congestion at the Port of Santos, coupled with high delay rates and significant wait times, poses a risk to supply disruptions, especially in light of Brazil's forecasted record coffee output. The normalization of Red Sea shipping diversions adds further complexity, increasing transit times and freight costs, impacting supply lines, particularly from regions like Vietnam. These logistics challenges could constrain coffee supply and lead to upward pressure on prices. The mention of EUDR tweaks suggests possible regulatory relief, but the primary focus is on logistical constraints. While the sentiment was initially tagged as 'BULLISH', it may need reconsideration as the evidence indicates challenges that could lead to price volatility rather than straightforward price increases.
[CONFIDENCE]: 0.8
[SENTIMENT TAG]: [SENTIMENT: BULLISH]",BULLISH,"[EVIDENCE]: ICE Arabica certified stocks reported at 428,064 bags on Feb 9, 2026, a decrease from the January 2026 high of ~461,000 bags (MacroMicro). The forward curve remains in backwardation as of Feb 9, 2026, with March 2026 contracts (299.20 cents/lb) trading at a premium to May 2026 (293.10 cents/lb) (CocoaIntel). Brazil's 2026 coffee production is forecast to grow 17.2% to a record 66.2 million bags (Conab). Vietnam reported January 2026 exports of 180,000 tonnes, a 25.5% year-on-year increase (CocoaIntel).
[ANALYSIS]: The market is currently defined by a sharp divergence between immediate physical scarcity and a bearish medium-term supply outlook. While the 17.2% projected growth in Brazil's crop and surging Vietnam exports (+25.5%) fundamentally cap long-term price potential, these supplies have not yet reached exchange delivery points. The persistence of backwardation (March premium over May) combined with the renewed drawdown in ICE certified stocks (falling to ~428k bags) confirms that spot demand continues to outstrip immediate availability. Therefore, despite the bearish macro-supply forecast, the micro-market structure necessitates a bullish stance for the near term until inventory levels stabilize or the Brazilian harvest physically enters the market.
[CONFIDENCE]: 0.65
[SENTIMENT TAG]: [SENTIMENT: BULLISH]",BEARISH,"[EVIDENCE]: 1. Latest COT report (data as of Feb 3, released Feb 6, 2026) showed Non-Commercial Longs at 49,342 (-7,776) and Shorts at 30,978 (+6,594) (source: CFTC / Tradingster). 2. Saxo Bank analysis on Feb 9, 2026 noted Arabica coffee net longs fell 13.2% in the reporting week ending Feb 3 (source: Saxo Bank). 3. StoneX reported on Feb 9, 2026 that the market responded to the COT report showing a reduction in non-commercial net length (source: StoneX). 4. Market analysis on Feb 4, 2026 described the sell-off as showing 'clear signs of oversold conditions' with losses exceeding 5,000 points over five sessions (source: CocoaIntel). 5. On Feb 10, 2026, Coffee prices settled sharply lower as increased precipitation in Brazil improved crop outlooks; Arabica fell to a 6-month low (source: Barchart).
[ANALYSIS]: Critique: 1. No major logical fallacies identified; the analysis avoids confirmation bias by incorporating both speculative liquidation and fundamental supply improvements, though it could exhibit mild recency bias by emphasizing the latest COT data without historical context for net long trends. False causation is minimal, as the link between reduced net longs and price drops is supported by market responses, but it's not definitively causal without further econometric evidence. 2. Sources are specific and cited (e.g., CFTC, Saxo Bank, StoneX, CocoaIntel, Barchart), with no vague claims; all evidence ties directly to dated reports. 3. The bearish sentiment tag is justified by the evidence of speculative unwinding, improved supply outlooks, and resulting price declines to 6-month lows, outweighing the mention of oversold conditions which suggests potential short-term rebound but not a reversal of the downward trend. Revised Analysis: The COT data reveals a sharp unwinding of speculative positions, with non-commercial longs dropping 7,776 contracts and shorts rising 6,594, resulting in a 13.2% decline in net longs. This speculative liquidation, corroborated by StoneX and Saxo Bank, aligns with fundamental improvements from increased Brazilian precipitation enhancing crop prospects (per Barchart), driving Arabica prices to 6-month lows. While the rapid 5,000-point sell-off indicates oversold conditions (CocoaIntel), the dominant drivers—eased speculative demand and bolstered supply—point to sustained downward pressure, though oversold signals warrant monitoring for a possible technical bounce.
[CONFIDENCE]: 0.8
[SENTIMENT TAG]: [SENTIMENT: BEARISH]",BEARISH,"[EVIDENCE]: [2026-02-11] Coffee Sep '26 (KCU26) last price 280.80 ¢/lb, down 3.20 ¢ (Barchart) | [2026-02-11] 14-day RSI for KCU26 = 30 (oversold) (Barchart) | [2026-02-11] KCU26 supports: 277.65 / 274.50 / 269.85 ¢; resistances: 285.45 / 290.10 / 293.25 ¢ (Barchart) | [2026-02-10] 200-day SMA (Coffee ‘C’) = 338.07 ¢/lb (Investing.com) | [2026-02-10] Brazil 2026 crop forecast raised to record 66.2 m bags, +17.2 % y/y (Conab via Barchart)
[ANALYSIS]: The market is trading 17 % under its 200-day SMA, confirming that longer-term momentum remains down. The latest Conab revision to a record 66.2 m-bag Brazilian crop is a fundamental head-wind: Brazil accounts for ~35 % of world supply, so a double-digit y/y increase meaningfully loosens the 2026/27 balance sheet. However, the conclusion that “supply dynamics dominate” risks an availability-bias fallacy because no demand data were considered (e.g., global consumption is still expanding ~2 %/yr; Vietnam’s robusta exports are down 11 % YTD). Linking the entire 57 ¢ discount to the crop revision is therefore an over-simplification (potential false-causation).

Technically, declaring a ‘persistent down-trend’ based only on price < 200-day SMA ignores the slope of that average and the series of higher lows that developed since late January; the trend may be flattening. The RSI at 30 is indeed oversold, yet the previous note assumed a bounce would stall below 290 ¢ without examining volume, COT positioning, or option skew—missing evidence for (or against) short-covering potential.

New information leaves the outlook mixed: 1) Record Brazilian output caps rallies; 2) The market is already discounting that news, shown by an RSI at the oversold threshold and futures near a triple-support band (277.65/274.50/269.85 ¢). 3) A close above 293 ¢ would negate the immediate bearish structure and target the 200-day SMA near 338 ¢. Until that happens, rallies are corrective, but follow-through selling is also losing momentum.

Overall, fundamentals lean bearish while technical and sentiment gauges warn of downside exhaustion. The proper stance is therefore «cautiously bearish», not outright bearish.
[CONFIDENCE]: 0.65
[SENTIMENT TAG]: [SENTIMENT: BEARISH]",BEARISH,"[EVIDENCE]: [2026-02-11] May 2026 Coffee (KCK26) IV is ~38.89% (90th percentile), significantly above the 25-35% historical norm. [2026-02-10] Conab forecasts a record 2026 Brazilian crop of 66.2 million bags (+17.2% YoY), supported by Minas Gerais rainfall at 113% of the historical average. [2026-02-10] Recent price action shows realized volatility exceeding implied levels with back-to-back drops of -4.85% and -3.84%, hitting 6-month lows. [2026-02-10] Options skew has flattened, signaling a capitulation of the long-standing weather-premium call skew.
[ANALYSIS]: The previous analysis correctly identified the bearish fundamental shift but potentially underestimated the risk of a technical oversold bounce given the velocity of the recent crash (-8% in two days). The revised view maintains a strong bearish stance based on the Conab record crop forecast (66.2M bags), which fundamentally caps upside potential and validates the removal of the drought risk premium. However, with IV at ~39% driven by downside panic rather than upside uncertainty, the market is in a 'crash' volatility regime. While selling calls (Bear Call Spread) remains the optimal structural trade to harvest rich premiums and fading skew, execution should ideally occur into a technical rally to avoid selling the exact bottom of a liquidation event. The fundamental supply glut confirms the direction, while the high IV confirms the vehicle (short premium).
[CONFIDENCE]: 0.8
[SENTIMENT TAG]: [SENTIMENT: BEARISH]",BEARISH,0.7,"The debate centers on whether current logistics and inventory dynamics present a real supply shock, contrasting with the bearish macro outlook signaling a record Brazilian harvest and a strong BRL. The Bear argues convincingly that the decline in Brazilian exports is more of a timing artifact due to farmer withholding influenced by a strong BRL, not genuine scarcity. This position is bolstered by supportive evidence from the Agronomist and Macro reports, which cite a projected record harvest and a currency scenario causing delayed sales. Additionally, speculative liquidation, evident through a sharp drop in non-commercial longs, aligns with improved weather conditions in Brazil that negate the need for a weather-premium. Despite the short-term logistics constraints and decreasing ICE stocks, the larger narrative is the anticipated increase in supply that could cap prices. Technical indicators, such as an oversold RSI, suggest potential for a tactical bounce but do not undermine the primary bearish trend confirmed by a more comprehensive overview of the data. [Consensus ALIGNED (Vote=BEARISH)]",DIRECTIONAL,,BEAR_PUT_SPREAD,True,,,,,,"[{""agent"": ""agronomist"", ""direction"": ""BEARISH"", ""confidence"": 0.8, ""domain_weight"": 2.25, ""reliability_mult"": 1.0, ""staleness_weight"": 1.0, ""age_hours"": 0.0, ""final_weight"": 2.25, ""contribution"": -1.8}, {""agent"": ""macro"", ""direction"": ""BEARISH"", ""confidence"": 0.65, ""domain_weight"": 1.5, ""reliability_mult"": 1.0, ""staleness_weight"": 1.0, ""age_hours"": 0.0, ""final_weight"": 1.5, ""contribution"": -0.975}, {""agent"": ""geopolitical"", ""direction"": ""BULLISH"", ""confidence"": 0.8, ""domain_weight"": 1.5, ""reliability_mult"": 1.0, ""staleness_weight"": 1.0, ""age_hours"": 0.0, ""final_weight"": 1.5, ""contribution"": 1.2}, {""agent"": ""supply_chain"", ""direction"": ""BULLISH"", ""confidence"": 0.8, ""domain_weight"": 1.5, ""reliability_mult"": 1.0, ""staleness_weight"": 1.0, ""age_hours"": 0.0, ""final_weight"": 1.5, ""contribution"": 1.2}, {""agent"": ""inventory"", ""direction"": ""BULLISH"", ""confidence"": 0.65, ""domain_weight"": 1.5, ""reliability_mult"": 1.0, ""staleness_weight"": 1.0, ""age_hours"": 0.0, ""final_weight"": 1.5, ""contribution"": 0.975}, {""agent"": ""sentiment"", ""direction"": ""BEARISH"", ""confidence"": 0.8, ""domain_weight"": 1.5, ""reliability_mult"": 1.0, ""staleness_weight"": 1.0, ""age_hours"": 0.0, ""final_weight"": 1.5, ""contribution"": -1.2}, {""agent"": ""technical"", ""direction"": ""BEARISH"", ""confidence"": 0.65, ""domain_weight"": 1.0499999999999998, ""reliability_mult"": 1.0, ""staleness_weight"": 1.0, ""age_hours"": 0.0, ""final_weight"": 1.05, ""contribution"": -0.682}, {""agent"": ""volatility"", ""direction"": ""BEARISH"", ""confidence"": 0.8, ""domain_weight"": 2.25, ""reliability_mult"": 1.0, ""staleness_weight"": 1.0, ""age_hours"": 0.0, ""final_weight"": 2.25, ""contribution"": -1.8}]",agronomist,-0.2362,scheduled,PLAUSIBLE,Imminent supply glut from record Brazilian harvest amidst speculative liquidation.,1.0,"The Bull's argument that logistics and current tight inventory conditions support a near-term bullish stance due to constrained supply. This is overridden by the broader anticipation of a supply increase and speculative position unwinding, which are deemed more influential in the medium term."
