cycle_id,timestamp,contract,entry_price,meteorologist_sentiment,meteorologist_summary,macro_sentiment,macro_summary,geopolitical_sentiment,geopolitical_summary,fundamentalist_sentiment,fundamentalist_summary,sentiment_sentiment,sentiment_summary,technical_sentiment,technical_summary,volatility_sentiment,volatility_summary,master_decision,master_confidence,master_reasoning,prediction_type,volatility_level,strategy_type,compliance_approved,exit_price,exit_timestamp,pnl_realized,actual_trend_direction,volatility_outcome,vote_breakdown,dominant_agent,weighted_score,trigger_type,thesis_strength,primary_catalyst,conviction_multiplier,dissent_acknowledged
KC-c87efbae,2026-02-10 17:08:38.638659+00:00,KCK6 (202605),289.55,BEARISH,"[EVIDENCE]: [2026-02-10] Forecasts for Minas Gerais show a 60-80% probability of rain... Somar Meteorologia reported 69.8 mm (117% of historical average) for the week ended Jan 30. [2026-02-10] As of February 2026, the crop is in the 'grain filling' stage; flowering typically occurs Sep-Nov. [2026-02-06] Conab forecasts a record 2026 crop (66.2 million bags), citing improved rainfall distribution.
[ANALYSIS]: The revised analysis explicitly links Somar Meteorologia's quantitative data (69.8 mm, 117% of average) to the specific biological needs of the crop during the 'grain filling' stage. By confirming that moisture is aiding bean sizing rather than disrupting flowering (which concluded in Nov), the evidence validates Conab's projection of a record 66.2 million bag harvest. This verified abundance of supply creates clear fundamental downward pressure on prices, justifying the bearish stance without relying on vague generalizations.
[CONFIDENCE]: 0.8
[SENTIMENT TAG]: [SENTIMENT: BEARISH]",BEARISH,"[EVIDENCE]: ['[2026-02-10] The USD/BRL exchange rate rose to 5.2020, up 0.16% from the previous session, but the Real has strengthened 3.25% over the past month. (source: Trading Economics)', ""[2026-02-10] Brazil's annual inflation rose to 4.44% in January, slightly up from 4.26% in December, but remains within the official target range. (source: Reuters / Investing.com)"", '[2026-02-03] The Central Bank of Brazil maintained the Selic rate at 15% but signaled readiness to start reducing rates in March. (source: TradingView)']
[ANALYSIS]: The strengthening Real (BRL) reduces the competitiveness of Brazilian coffee exports and encourages farmers to hold off on selling, expecting that a weaker Real in the future might enhance their local currency returns. This trend is compounded by high interest rates, which keep borrowing costs elevated, discouraging immediate sales unless liquidity is critical. The potential easing of the Selic rate starting in March might gradually alleviate these pressures if it leads to BRL weakening. However, the current exchange strength suggests potential supply constraints on international markets as Brazilian coffee becomes more expensive for forex-denominated buyers.
[CONFIDENCE]: 0.3
[SENTIMENT TAG]: [SENTIMENT: BEARISH]",BULLISH,"[EVIDENCE]: [""[2026-02-10] Heavy rains and a record soybean harvest are causing the 'worst loading disruptions since January' at the Port of Santos. (source: Rio Times / Cargonave)"", ""[2026-02-10] The Thünen Centre of Competence released a 'Charcoal Atlas' to support EUDR compliance, despite the regulation's delay. (source: idw-online.de)"", '[2026-02-02] Container dwell times at the Port of Santos can reach up to 10 days due to infrastructure bottlenecks. (source: Seatrade Maritime)', '[2026-01-26] Container ship calls at the Port of Santos were reported at 41 units, a slight decrease from the previous week. (source: CEIC Data)', '[2026-02-10] As of February 10, 2026, global coffee logistics face significant challenges. In Brazil, the Port of Santos is experiencing severe congestion due to a record soybean harvest colliding with persistent heavy rains. (source: Rio Times / Cargonave)']
[ANALYSIS]: The evidence indicates significant logistical bottlenecks at the Port of Santos, primarily driven by a record soybean harvest and persistent heavy rains, which are causing severe loading disruptions and contributing to container dwell times of up to 10 days. This congestion affects coffee exports, potentially constraining supply from one of the world's largest coffee producers. In addition, the delay of the EU Deforestation Regulation (EUDR) provides regulatory breathing room, though compliance preparations continue, which might slightly ease trade operation disruptions. Overall, the increased logistical difficulties at Santos combined with ongoing challenges in other regions like the Red Sea mean restricted coffee supply, potentially applying further upward pressure on Arabica prices.
[CONFIDENCE]: 0.9
[SENTIMENT TAG]: [SENTIMENT: BULLISH]",BEARISH,"[EVIDENCE]: ['ICE Arabica Certified Stocks rose to 428,064 bags on Feb 9, 2026, increasing from 421,173 bags on Feb 6, 2026 (MacroMicro).', 'Stocks pending grading or certification at ICE warehouses were reported to be starting to rise as of Feb 10, 2026 (Business Recorder).', 'The forward curve remains in backwardation, with March 2026 futures (~308.65 cents) trading at a premium to May 2026 (~297.85 cents) as of Feb 4, 2026 (Investing.com).', 'The Green Coffee Association (GCA) has permanently ceased publishing monthly U.S. warehouse stock data as of Jan 30, 2026 (StoneX).']
[ANALYSIS]: The inventory data indicates a pivotal shift in supply dynamics. While the forward curve remains in backwardation (signaling historical tightness), the ICE Certified Stocks have reversed their recent drawdown, increasing by nearly 7,000 bags between Feb 6 and Feb 9. This immediate build, coupled with reports of rising stocks pending grading, triggers the 'Building = Bearish' operational rule and suggests the acute scarcity may be alleviating. The persistence of backwardation implies the market has not yet fully priced in this inventory recovery, but the directional flow of visible stocks is now negative for prices.
[CONFIDENCE]: 0.3
[SENTIMENT TAG]: [SENTIMENT: BEARISH]",NEUTRAL,"[EVIDENCE]: 1. CFTC COT report released February 6, 2026 (data as of Feb 3) shows Managed Money net length at 23,876 contracts (Long: 39,227, Short: 15,351). 2. Legacy COT report shows Non-Commercial net length at +18,364 contracts (Long: 49,342, Short: 30,978). 3. Coffee futures down about 10% last week, reflecting healthy global supply outlook and deleveraging. 4. Technical indicators on February 9 show RSI(14) at 44.214 (Neutral), signaling the market is not overbought. 5. StoneX reports short covering and momentum buying attempting to challenge resistance below 300.00 following net length reduction.
[ANALYSIS]: The significant reduction in non-commercial net long positions to 18,364 contracts indicates deleveraging by speculators amid a 10% price decline, suggesting weakened speculative demand and a perception of improved supply availability from global outlooks like a healthy Brazilian crop. This shift has moved the market from prior overextended conditions to neutral territory, as evidenced by RSI at 44 (neutral) and emerging short covering, implying a stabilizing supply/demand balance with reduced risk of overbought pressure but potential for further correction if supply expectations strengthen.
[CONFIDENCE]: 0.9
[SENTIMENT TAG]: [SENTIMENT: NEUTRAL]",BEARISH,"[EVIDENCE]: [2026-02-09] May-26 Coffee (KCK26) last close: 294.25 ¢/lb—down 10.9 % in five sessions (Barchart). 200-day SMA: 335.21 ¢/lb; 50-day SMA: 308.64 ¢/lb—both angled lower (Investing.com). 14-day RSI: 25.36 (oversold) (Barchart). Nearest support: 292.57 / 285.28 / 278.77 ¢; resistance: 300.33 / 306.37 / 312.88 ¢ (Investing.com). No fresh fundamental data supplied in sources.
[ANALYSIS]: Technical structure is clearly negative: price sits ≈12 % under its 200-day SMA and below every shorter-term average, while the 50/200-day ‘death-cross’ cements a longer-term down-trend. Lower highs / lower lows confirm sellers control.    Momentum, however, is stretched—the RSI below 30 often precedes short-covering rallies. A reflex move toward 300-306 ¢ is plausible, yet would still leave the contract beneath trend-defining averages. Only consecutive closes back above 312-335 ¢ (top of current resistance cluster and 200-day SMA) would neutralise the bearish bias.    Caution: the previous note attributed the slide to “ample supply” without evidence—no export, weather, or stock data were cited. Until fundamentals are documented, analysis should remain technically focused.    Net: trend is bearish, momentum is oversold. Traders may favour selling rallies toward moving-average resistance, but tight risk controls are warranted because oversold rebounds can be sharp.
[CONFIDENCE]: 0.65
[SENTIMENT TAG]: [SENTIMENT: BEARISH]",NEUTRAL,Error conducting research: 'list' object has no attribute 'get',BEARISH,0.7,"The bearish thesis is more grounded considering the multiple evidence lines indicating a temporary nature to the current logistical disruptions at the Port of Santos. The Agronomist and Inventory Reports highlight a record crop ready for export once logistical issues are resolved, and an increase in ICE Arabica stocks suggests supply constraints are easing. The Permabear's argument that these are temporary, self-correcting issues backed by the forecast of a record Brazilian harvest undermines the bullish supply shock case. Speculative positioning appears exhausted, minimizing the potential for significant short-covering rallies. Although the oversold technical conditions suggest potential for a minor rebound, no substantial evidence of a sustained upward move was presented, confirming the bearish sentiment. Given these conditions, the thesis aligns with the current technical and logistic realities favoring downward price pressure. [Consensus ALIGNED (Vote=BEARISH)]",DIRECTIONAL,,BEAR_PUT_SPREAD,True,,,,,,"[{""agent"": ""agronomist"", ""direction"": ""BEARISH"", ""confidence"": 0.8, ""domain_weight"": 1.5, ""reliability_mult"": 1.0, ""staleness_weight"": 1.0, ""age_hours"": 0.0, ""final_weight"": 1.5, ""contribution"": -1.2}, {""agent"": ""macro"", ""direction"": ""BEARISH"", ""confidence"": 0.3, ""domain_weight"": 1.5, ""reliability_mult"": 1.0, ""staleness_weight"": 1.0, ""age_hours"": 0.0, ""final_weight"": 1.01, ""contribution"": -0.304}, {""agent"": ""geopolitical"", ""direction"": ""BULLISH"", ""confidence"": 0.9, ""domain_weight"": 1.5, ""reliability_mult"": 1.0, ""staleness_weight"": 1.0, ""age_hours"": 0.0, ""final_weight"": 1.01, ""contribution"": 0.911}, {""agent"": ""supply_chain"", ""direction"": ""BULLISH"", ""confidence"": 0.9, ""domain_weight"": 1.5, ""reliability_mult"": 1.0, ""staleness_weight"": 1.0, ""age_hours"": 0.0, ""final_weight"": 0.38, ""contribution"": 0.338}, {""agent"": ""inventory"", ""direction"": ""BEARISH"", ""confidence"": 0.3, ""domain_weight"": 1.5, ""reliability_mult"": 1.0, ""staleness_weight"": 1.0, ""age_hours"": 0.0, ""final_weight"": 1.01, ""contribution"": -0.304}, {""agent"": ""sentiment"", ""direction"": ""NEUTRAL"", ""confidence"": 0.9, ""domain_weight"": 1.5, ""reliability_mult"": 1.0, ""staleness_weight"": 1.0, ""age_hours"": 0.0, ""final_weight"": 1.01, ""contribution"": 0.0}, {""agent"": ""technical"", ""direction"": ""BEARISH"", ""confidence"": 0.65, ""domain_weight"": 2.25, ""reliability_mult"": 1.0, ""staleness_weight"": 1.0, ""age_hours"": 0.0, ""final_weight"": 2.25, ""contribution"": -1.463}, {""agent"": ""volatility"", ""direction"": ""NEUTRAL"", ""confidence"": 0.0, ""domain_weight"": 1.0499999999999998, ""reliability_mult"": 1.0, ""staleness_weight"": 1.0, ""age_hours"": 0.0, ""final_weight"": 1.05, ""contribution"": 0.0}]",technical,-0.2191,manual,PLAUSIBLE,"Port congestion expected to resolve soon, and inventory builds negate scarcity narrative.",1.0,"Bull argues that logistics disruptions are structural and persistent; however, evidence from permabear shows they're attributed to seasonal factors that will normalize shortly."
KC-5c44650d,2026-02-10 17:14:00.577089+00:00,KCN6 (202607),288.6,BEARISH,"[EVIDENCE]: [2026-02-09] Minas Gerais received 72.6 mm of rain in the week ended Feb 6, representing 113% of the historical average (Source: Somar Meteorologia). [2026-02-06] Recent rains are explicitly favoring the 'filling of the beans' stage for Arabica, rather than flowering (Source: Cepea). [2026-02-06] Conab projects Brazil's 2026 coffee production will reach a record 66.2 million bags, up 17.2% due to favorable weather (Source: Conab).
[ANALYSIS]: The convergence of Conab's record production forecast (66.2 million bags, +17.2%) with real-time meteorological data validates a high-supply outlook. Somar Meteorologia reports rainfall at 113% of historical averages in Minas Gerais, which Cepea confirms is agronomically optimal for the current 'bean-filling' stage. This specific timing negates concerns of crop damage and reinforces the probability of a bumper crop, exerting downward pressure on prices.
[CONFIDENCE]: 0.8
[SENTIMENT TAG]: [SENTIMENT: BEARISH]",BEARISH,"[EVIDENCE]: ['[2026-02-10] USD/BRL exchange rate is approximately 5.20, having strengthened 3.25% over the last month. (source: Trading Economics)', '[2026-02-10] Farmers are selling the new soybean crop at a slower pace than previous years due to the strengthening local currency and low prices. (source: UkrAgroConsult)', '[2026-02-09] Brazilian soybean sales are estimated at 33.9% of the crop, lagging the historical average of roughly 45%. (source: ADM Investor Services / Safras & Mercado)', ""[2026-02-03] Brazil's Central Bank maintained the Selic rate at 15% but signaled readiness to start cutting rates in March. (source: TradingView)"", '[2026-02-10] Market consensus expects the Selic rate to end 2026 at roughly 12.0% to 12.25%. (source: Investing.com / Focus Survey)']
[ANALYSIS]: The strengthening of the Brazilian Real (USD/BRL at 5.20, up 3.25% over the past month) is negatively affecting farmer selling by reducing their income from exports in local currency. This trend is evident as soybean sales are significantly below historical averages, which implies that similar impacts could be occurring in the coffee sector. With the Central Bank's high Selic rate and upcoming rate cuts not yet in effect, the current strong Real is expected to continue hindering competitive pricing for Brazilian coffee exports. Thus, there could be a supply constraint as farmers might be inclined to withhold coffee stocks until conditions improve.
[CONFIDENCE]: 0.8
[SENTIMENT TAG]: [SENTIMENT: BEARISH]",BULLISH,"[EVIDENCE]: ['[2026-02-10] The Thünen Centre of Competence released a ""Charcoal Atlas"" to support EUDR compliance verification, emphasizing that the regulation's delay is not a pause in preparation. (source: idw-online.de)', '[2026-02-05] Maersk has completed two successful Red Sea voyages, signaling a tentative return to the Suez route which may trigger short-term port congestion in Europe. (source: Global Trade Magazine)', '[2026-01-19] In January 2026, the Port of Santos recorded a 77% delay rate for container ships, with 672,113 bags of coffee rolled over/not shipped. (source: Cecafé / StoneX)', '[2026-01-19] The longest waiting time for coffee export vessels at the Port of Santos in January was 40 days. (source: Cecafé / StoneX)', '[2026-01-30] Maersk announced it would begin transiting ships through the Red Sea/Suez Canal again, starting with its MECL service. (source: Timescan Logistics)']
[ANALYSIS]: The data indicates prolonged logistical bottlenecks impacting the Arabica coffee supply chain. The Port of Santos, a key hub in Brazil, continues to face severe congestion, as highlighted by a 77% delay rate and significant numbers of unshipped coffee bags. This situation suggests a restriction in the outflow of Brazilian coffee, likely contributing to supply tightness. Concurrently, the gradual reopening of the Red Sea route, while a positive development, is anticipated to cause short-term congestion in European ports, complicating global supply chain dynamics. Additionally, while the EU Deforestation Regulation's enforcement delay offers temporary relief, it mandates ongoing compliance preparation, adding pressure to the operational landscape.
[CONFIDENCE]: 0.85
[SENTIMENT TAG]: [SENTIMENT: BULLISH]",NEUTRAL,"[EVIDENCE]: [""The Grounded Data Packet explicitly states 'No specific dated facts extracted'."", 'The Raw Research Findings section was truncated or empty.', 'No URLs were captured in the Sources Consulted section.']
[ANALYSIS]: The provided Grounded Data Packet contains insufficient information to perform an analysis. There are no current data points regarding ICE Arabica Certified Stocks, GCA Green Coffee Stocks, or the forward curve structure (backwardation/contango). Consequently, it is impossible to assess supply tightness, inventory trends, or market sentiment based strictly on the provided input.
[CONFIDENCE]: 0.0
[SENTIMENT TAG]: [SENTIMENT: NEUTRAL]",BEARISH,"[EVIDENCE]: 1. CFTC COT report released February 6, 2026 (data through February 3): Non-Commercial Net Long position at 18,364 contracts, down 14,370 from the previous week (source: CFTC / InvestMacro). 2. Saxo Bank analysis on February 9, 2026: Arabica coffee managed money net longs fell by 13.2% in the reporting week (source: Saxo Bank). 3. StoneX Daily Coffee Report on February 10, 2026: Coffee futures opened stronger responding to the COT report showing a reduction in non-commercial net length (source: StoneX). 4. Market analysis on February 4, 2026: Coffee market showing 'clear signs of oversold conditions' due to aggressive speculative liquidation (source: CocoaIntel). 5. Speculator sentiment score at 41.6% (Bearish), indicating dissipated overbought conditions (source: InvestMacro).
[ANALYSIS]: The sharp decline in non-commercial net long positions to 18,364 contracts, with a 14,370 contract reduction and 13.2% drop in managed money net longs, reflects aggressive liquidation of bullish bets by speculators, easing speculative demand pressure and suggesting perceptions of improved supply availability or oversupply in the coffee market. This has shifted the market from prior overbought to oversold conditions, with stronger futures opens indicating potential stabilization, though the bearish sentiment score points to weakened demand relative to supply in the short term.
[CONFIDENCE]: 0.9
[SENTIMENT TAG]: [SENTIMENT: BEARISH]",NEUTRAL,"[EVIDENCE]: [2026-02-10] July ’26 coffee (KCN6) last trade ≈ 293.00 ¢/lb with nearby support 287.70 – 282.40 ¢ and resistance 300.85 – 308.70 ¢ (Barchart); [2026-02-09] 200-day SMAs for March ’26 (KCH6) 342.83 ¢ and May ’26 (KCK6) 335.21 ¢ (Investing.com/Barchart); daily stochastics registered a bullish crossover below the 20 % band (Palmetto Grain Brokerage).
[ANALYSIS]: The contract is trading well below the 200-day moving averages that govern the more actively traded March and May ’26 deliveries, underscoring a structurally negative trend. The 287.70–282.40 ¢ area—where horizontal price memory from late-2025 lows and a minor Fibonacci retracement converge—creates a nearby demand pocket; failure to hold that shelf would likely expose 275 ¢ and potentially last summer’s 262 ¢ pivot. Momentum, however, is beginning to diverge from price: the bullish stochastic crossover out of sub-20 territory signals waning downside force and often precedes short-covering rallies. To validate a corrective rebound, the market must close above 300.85 ¢ and then 308.70 ¢; such a move would shift near-term risk toward 320 ¢ and challenge the descending 200-day SMA cluster. Until those upside levels are conquered, rallies are tactical and the dominant trend remains lower. Volume has been below its 20-day average for four straight sessions, hinting that sellers are becoming less aggressive but also that conviction among would-be buyers is thin. Risk-tolerant traders might scale into small long positions against 282.40 ¢ with tight stops, while longer-term participants should wait for a weekly settlement back above 310 ¢ to confirm a trend change. Overall, evidence is mixed: trend indicators are bearish, momentum indicators are turning constructive, and volume is inconclusive—supporting a Neutral stance.
[CONFIDENCE]: 0.65
[SENTIMENT TAG]: [SENTIMENT: NEUTRAL]",BEARISH,"[EVIDENCE]: [""[2026-02-10] May 2026 (KCK26) Implied Volatility is 38.89% and July 2026 (KCN6) is 37.46%, levels described as 'expensive' relative to historical norms."", '[2026-02-09] Conab forecasts a record 2026 Brazilian coffee crop of 66.2 million bags, with Arabica production up 23.2%.', '[2026-02-10] Coffee futures are trading near 6-month lows, with March (KCH26) closing around 296.55 cents/lb.', '[2026-02-10] Market structure shows a shift to downside fear (put skew) replacing the typical weather-related call skew.']
[ANALYSIS]: The options market is currently in a HIGH_VOL regime, with Implied Volatility (IV) for May and July contracts elevated at ~37-39%. This 'expensive' premium reflects the recent sharp liquidation and uncertainty surrounding the extent of the price drop. Fundamentally, the record Brazilian crop forecast (66.2m bags) provides a persistent bearish structural driver, pushing prices to 6-month lows. The presence of put skew confirms that market participants are paying up for downside protection rather than betting on a rebound. Consequently, the recommended strategy is to sell into this strength via a Bear Call Spread, capitalizing on the rich volatility premiums while aligning with the dominant bearish supply outlook.
[CONFIDENCE]: 0.9
[SENTIMENT TAG]: [SENTIMENT: BEARISH]",BEARISH,0.7,"The bearish argument is more grounded given the overwhelming evidence of a record Brazilian coffee crop poised to flood the market eventually. The Agronomist Report estimates a record 66.2 million bags (+17.2%) for 2026, supported by favorable weather conditions. Despite logistical bottlenecks creating temporary scarcity, this is likely to be resolved, leading to a significant supply influx. Furthermore, the speculative liquidation indicates a lack of confidence in a bullish rebound, with a notable reduction in non-commercial net long positions, suggesting an oversupply perception. While logistical issues and currency dynamics contribute to short-term tightness, the impending large supply is the primary concern. The avoidance of aggressive speculative positions supports a bearish perspective, and the volatility report confirms downside protection is preferred. While short-term rallies could occur, structural factors point to a bearish longer-term direction. [Consensus ALIGNED (Vote=BEARISH)]",DIRECTIONAL,,BEAR_PUT_SPREAD,True,,,,,,"[{""agent"": ""agronomist"", ""direction"": ""BEARISH"", ""confidence"": 0.8, ""domain_weight"": 2.25, ""reliability_mult"": 1.0, ""staleness_weight"": 1.0, ""age_hours"": 0.0, ""final_weight"": 2.25, ""contribution"": -1.8}, {""agent"": ""macro"", ""direction"": ""BEARISH"", ""confidence"": 0.8, ""domain_weight"": 1.5, ""reliability_mult"": 1.0, ""staleness_weight"": 1.0, ""age_hours"": 0.0, ""final_weight"": 1.01, ""contribution"": -0.81}, {""agent"": ""geopolitical"", ""direction"": ""BULLISH"", ""confidence"": 0.85, ""domain_weight"": 1.5, ""reliability_mult"": 1.0, ""staleness_weight"": 1.0, ""age_hours"": 0.0, ""final_weight"": 1.01, ""contribution"": 0.861}, {""agent"": ""supply_chain"", ""direction"": ""BULLISH"", ""confidence"": 0.9, ""domain_weight"": 1.5, ""reliability_mult"": 1.0, ""staleness_weight"": 1.0, ""age_hours"": 0.0, ""final_weight"": 1.01, ""contribution"": 0.911}, {""agent"": ""inventory"", ""direction"": ""NEUTRAL"", ""confidence"": 0.0, ""domain_weight"": 1.5, ""reliability_mult"": 1.0, ""staleness_weight"": 1.0, ""age_hours"": 0.0, ""final_weight"": 1.5, ""contribution"": 0.0}, {""agent"": ""sentiment"", ""direction"": ""BEARISH"", ""confidence"": 0.9, ""domain_weight"": 1.5, ""reliability_mult"": 1.0, ""staleness_weight"": 1.0, ""age_hours"": 0.0, ""final_weight"": 1.01, ""contribution"": -0.911}, {""agent"": ""technical"", ""direction"": ""NEUTRAL"", ""confidence"": 0.65, ""domain_weight"": 1.0499999999999998, ""reliability_mult"": 1.0, ""staleness_weight"": 1.0, ""age_hours"": 0.0, ""final_weight"": 1.05, ""contribution"": 0.0}, {""agent"": ""volatility"", ""direction"": ""BEARISH"", ""confidence"": 0.9, ""domain_weight"": 2.25, ""reliability_mult"": 1.0, ""staleness_weight"": 1.0, ""age_hours"": 0.0, ""final_weight"": 1.52, ""contribution"": -1.367}]",agronomist,-0.3005,manual,PLAUSIBLE,Record Brazilian coffee production amidst logistical bottlenecks.,1.0,"The permabull argument highlights temporary logistical constraints and farmer hoarding due to a strong BRL, which could suggest short-term bullish potential. However, this is overridden by the imminent reality of a record crop and the potential release of pent-up supply once logistical issues resolve and currency pressures ease."
