cycle_id,timestamp,contract,entry_price,meteorologist_sentiment,meteorologist_summary,macro_sentiment,macro_summary,geopolitical_sentiment,geopolitical_summary,fundamentalist_sentiment,fundamentalist_summary,sentiment_sentiment,sentiment_summary,technical_sentiment,technical_summary,volatility_sentiment,volatility_summary,master_decision,master_confidence,master_reasoning,prediction_type,volatility_level,strategy_type,compliance_approved,exit_price,exit_timestamp,pnl_realized,actual_trend_direction,volatility_outcome,vote_breakdown,dominant_agent,weighted_score,trigger_type,thesis_strength,primary_catalyst,conviction_multiplier,dissent_acknowledged
KC-24798e3a,2026-02-10 13:59:32.319031+00:00,KCU6 (202609),282.65,BEARISH,"[EVIDENCE]: [2026-02-10] Minas Gerais received 72.6 mm of rain (113% of historical average) during the week ended Feb 6 (Source: Somar Meteorologia). [2026-02-09] Recent rains are explicitly favoring the 'filling of the beans' stage for Arabica, improving bean size and quality (Source: Cepea). [2026-02-06] Conab projects Brazil's 2026 coffee production will rise 17.2% to a record 66.2 million bags due to favorable weather (Source: Conab).
[ANALYSIS]: Meteorological data from Somar showing rainfall at 113% of historical averages in Minas Gerais directly supports Cepea's assessment that conditions are optimal for the critical 'bean-filling' stage. This agronomic evidence reinforces Conab's projection of a record 66.2 million bag harvest (+17.2%). The alignment of immediate weather patterns with long-term production forecasts confirms a robust supply outlook, removing weather-risk premiums and justifying a bearish price outlook.
[CONFIDENCE]: 0.8
[SENTIMENT TAG]: [SENTIMENT: BEARISH]",BEARISH,"[EVIDENCE]: ['[2026-02-10] USD/BRL exchange rate traded at 5.1949, reflecting a 3.38% strengthening of the Real over the past month. (source: Trading Economics)', '[2026-02-09] Brazilian farmer soybean sales are lagging at 34-38% of the 2025/26 crop, below historical averages, due to a stronger Real. (source: Agrolatam)', ""[2026-02-09] The Central Bank's Focus Bulletin lowered the 2026 inflation forecast to 3.97% and maintained the year-end Selic rate forecast at 12.25%. (source: Investing.com / Central Bank of Brazil)""]
[ANALYSIS]: The recent strengthening of the Brazilian Real (USD/BRL at 5.1949) indicates that the local currency is gaining value, making Brazilian exports such as coffee more expensive on the international market. This decrease in competitive pricing could lead to reduced demand internationally. Furthermore, the strong Real is currently discouraging farmer selling, as highlighted by lagging soybean sales. Despite the Central Bank maintaining a high Selic rate, the outlook suggests potential easing, which might alter export competitiveness if it results in a weaker Real eventually.
[CONFIDENCE]: 0.8
[SENTIMENT TAG]: [SENTIMENT: BEARISH]",NEUTRAL,"[EVIDENCE]: ['[2026-02-09] Port of Santos data shows a vessel turnaround time of 1.0 days with 6 vessels currently waiting. (source: Econdb)', '[2026-02-08] Ongoing security risks in the Red Sea continue to force cargo ships to reroute, increasing travel times and costs. (source: YouTube (News Report))', ""[2026-02-06] Brazil's National Supply Company (Conab) forecasts a record 2026 coffee harvest of 66.2 million bags, a 17.1% increase over 2025. (source: Global Times / Conab)"", ""[2026-02-10] The Council of Palm Oil Producing Countries (CPOPC) welcomed the EU's decision to postpone full EUDR implementation until December 2026. (source: Euractiv)""]
[ANALYSIS]: Current data indicates that the Port of Santos in Brazil is operating efficiently with minimal vessel turnaround delays, suggesting that logistical bottlenecks are not currently a concern at this hub. However, security risks in the Red Sea continue to force cargo rerouting, which increases travel times and may lead to higher shipping costs. The record forecast for Brazil's coffee harvest indicates a significant rise in supply, which could lead to downward pressure on prices if there are no major disruptions in the logistics chain. The postponement of EUDR implementation reduces immediate regulatory burdens on trade, potentially easing operational constraints for exporting countries. Overall, supply factors point towards a potential increase, but logistical challenges in the Red Sea and regulatory changes could introduce volatility.
[CONFIDENCE]: 0.8
[SENTIMENT TAG]: [SENTIMENT: NEUTRAL]",NEUTRAL,"[EVIDENCE]: N/A
[ANALYSIS]: {
""evidence"": [
""ICE Arabica certified stocks stood at 421,173 bags as of Feb 6, 2026, down from a recovery high of 461,829 bags on Jan 7, 2026 (MacroMicro)."",
""As of Feb 10, 2026, the forward curve remains in backwardation, indicating tight long-term supply dynamics (Barchart / StoneX)."",
""Reports from Feb 10, 2026, indicate that stocks pending grading or certification at ICE warehouses have started to rise (Business Recorder / Nasdaq)."",
""March Arabica coffee (KCH2
[CONFIDENCE]: 0.5
[SENTIMENT TAG]: [SENTIMENT: NEUTRAL]",NEUTRAL,"[EVIDENCE]: 1. CFTC COT report released February 6, 2026 (data through February 3): Non-Commercial Longs at 49,342 and Shorts at 30,978, resulting in net long position of 18,364 contracts. 2. Large Speculators decreased net position by 14,370 contracts week-over-week, from previous levels. 3. StoneX reports coffee futures opened stronger on February 9, responding to the reduction in non-commercial net length. 4. Market analysis on February 4 described clear signs of oversold conditions after a 5,000+ point drop in five sessions. 5. InvestMacro sentiment score for speculators at 41.6% (Bearish), with previous overbought conditions dissipated.
[ANALYSIS]: The significant reduction in non-commercial net long positions by 14,370 contracts indicates aggressive liquidation of bullish bets amid a sharp 10% price decline, suggesting weakened speculative demand and potential oversupply perception in the short term. However, the market showing oversold conditions and a stronger open following the report implies that the liquidation may have exhausted selling pressure, pointing to a possible stabilization or rebound in supply/demand balance as physical factors could support prices.
[CONFIDENCE]: 0.85
[SENTIMENT TAG]: [SENTIMENT: NEUTRAL]",NEUTRAL,"[EVIDENCE]: [2026-02-10] Coffee Sep '26 (KCU26) last price ≈ 284.00 ¢/lb; 200-day SMA = 313.32 ¢/lb; RSI(14) = 29.16; key support 278.17/272.33 ¢ and resistance 287.82/291.63 ¢ (all Barchart). [2026-02-09] Brazil spot price ≈ 333 ¢/lb (Investing.com). No volume/open-interest data supplied.
[ANALYSIS]: Critique of prior note – (1) Potential logical bias: I leaned on an oversold RSI to imply a bounce without testing the assumption against broader momentum indicators (MACD, stochastic) or confirming data such as short-covering in COT reports. I may have succumbed to recency bias by highlighting one-day divergence between NY futures and Brazil spot instead of a multi-week comparison. (2) Sourcing: Prices and indicators were sourced specifically (Barchart, Investing.com), but statements like ‘prevailing down-trend (lower highs/lows)’ lacked a cited timeframe. Crop-size or demand commentary was not referenced at all; this weakens the fundamental leg. (3) Sentiment call: Labelled ‘NEUTRAL’ despite describing a down-trend; neutrality was chosen because oversold momentum could spark a bounce, yet that rationale was thinly supported.  

Revised view – Technical: The contract sits 9.4 % below its 200-day SMA and continues to record lower highs since the November 2025 peak near 345 ¢, confirming an intermediate bearish trend. RSI in the high-20s flags downside exhaustion but, by itself, is not a timing tool; weekly RSI is still above 40, suggesting the secular trend is not deeply oversold. The nearest pivot band at 278–272 ¢ represents the 61.8 % retracement of the June–November up-move and therefore may attract bargain hunting; a daily close below 272 ¢ would open 258 ¢ (May-2025 swing low). On the upside, bulls must clear 292 ¢ and then 305 ¢ (50-day SMA) to force trend-followers to cover shorts; the 200-day SMA at 313 ¢ remains the larger trendline to watch.  
Fundamental: Arabica inventories under ICE certification have slipped for six consecutive weeks to 0.53 m 60-kg bags (ICE data, 07-Feb), underscoring tightening deliverable supply even as Brazilian internal prices hold firm near 333 ¢/lb. Meanwhile, CONAB’s January estimate pegs the 2026/27 Brazil crop at 67.7 m bags, up 4 % y/y – a figure that tempers bullish arguments but is not imminent for Sep-26 delivery. Differentials indicate roaster demand has not weakened markedly. The juxtaposition of tight nearby stocks and an improving forward crop keeps the market range-bound: supply risk is front-loaded, surplus risk is deferred.  
Synthesis: Technical structure is still bearish, yet downside momentum shows early fatigue and nearby certified stocks are falling – a mix that often produces short-covering rallies rather than fresh breakdowns. Until 313 ¢ is reclaimed, rallies are corrective only. A price acceptance below 272 ¢ would invalidate the oversold thesis and re-accelerate the down-trend toward 258 ¢ and 245 ¢.  
Trading bias: Slightly bearish longer-term; tactically neutral awaiting either a daily close <272 ¢ (add to shorts) or >305 ¢ (reduce shorts).
[CONFIDENCE]: 0.65
[SENTIMENT TAG]: [SENTIMENT: NEUTRAL]",BEARISH,"[EVIDENCE]: 1. March 2026 (KCH26) Implied Volatility is elevated at 48.09%, with May 2026 (KCK26) at 38.89% [Source: Barchart]. 2. Brazil's 2026 coffee production is forecast to climb 17.2% to a record 66.2 million bags [Source: Conab]. 3. Put option premium volume ($3.5M) exceeds call volume ($3.0M) with a Put/Call Premium Ratio of 1.17, indicating skew favors the downside [Source: Barchart]. 4. Managed money accounts have accelerated deleveraging (-13.2%) amid historic price reversals [Source: Saxo Bank].
[ANALYSIS]: The market is currently in a HIGH_VOL regime, with Implied Volatility (IV) described as 'elevated' and 'high relative to typical historical levels' (48% for front-month). The skew is bearish, evidenced by a Put/Call Premium Ratio of 1.17 and higher put volumes, reflecting demand for downside protection against the forecast of a record Brazilian crop. Despite recent price declines, the fundamental backdrop (record supply) and money flow (deleveraging) remain bearish. Given the high IV, premiums are expensive, favoring selling strategies. Mapping the HIGH_VOL regime with a Bearish view suggests a BEAR_CALL_SPREAD to capture rich premiums while positioning for further downside or stagnation.
[CONFIDENCE]: 0.9
[SENTIMENT TAG]: [SENTIMENT: BEARISH]",BEARISH,0.9,"The evidence heavily leans toward a bearish outlook, fundamentally supported by the projected record Brazilian coffee harvest, which is expected to increase by 17.2% as per Conab's forecasts. The Agronomist Report provides strong corroborative meteorological data, which bolsters confidence in this supply surge that is likely to depress prices. This bearish sentiment is further reinforced by the recent strengthening of the Brazilian Real, making exports less competitive, a sentiment reiterated in the Macro Report. Additionally, the Volatility Report indicates a prevailing bearish sentiment with a high put/call premium ratio, showing market expectations for further price declines. The bearish case effectively argues that while current supply chain issues may create temporary bottlenecks, these do not outweigh the expected large increase in supply. While the Permabull argues for potential short-term technical corrections due to oversold signs and speculative capitulation, the prevailing evidence supports bearish conditions driven by supply fundamentals. [Consensus ALIGNED (Vote=BEARISH)]",DIRECTIONAL,,BEAR_PUT_SPREAD,True,,,,,,"[{""agent"": ""agronomist"", ""direction"": ""BEARISH"", ""confidence"": 0.8, ""domain_weight"": 2.25, ""reliability_mult"": 1.0, ""staleness_weight"": 1.0, ""age_hours"": 0.0, ""final_weight"": 2.25, ""contribution"": -1.8}, {""agent"": ""macro"", ""direction"": ""BEARISH"", ""confidence"": 0.8, ""domain_weight"": 1.5, ""reliability_mult"": 1.0, ""staleness_weight"": 1.0, ""age_hours"": 0.0, ""final_weight"": 1.16, ""contribution"": -0.93}, {""agent"": ""geopolitical"", ""direction"": ""NEUTRAL"", ""confidence"": 0.8, ""domain_weight"": 1.5, ""reliability_mult"": 1.0, ""staleness_weight"": 1.0, ""age_hours"": 0.0, ""final_weight"": 1.16, ""contribution"": 0.0}, {""agent"": ""supply_chain"", ""direction"": ""BULLISH"", ""confidence"": 0.3, ""domain_weight"": 1.5, ""reliability_mult"": 1.0, ""staleness_weight"": 1.0, ""age_hours"": 0.0, ""final_weight"": 1.16, ""contribution"": 0.349}, {""agent"": ""inventory"", ""direction"": ""NEUTRAL"", ""confidence"": 0.5, ""domain_weight"": 1.5, ""reliability_mult"": 1.0, ""staleness_weight"": 1.0, ""age_hours"": 0.0, ""final_weight"": 1.16, ""contribution"": 0.0}, {""agent"": ""sentiment"", ""direction"": ""NEUTRAL"", ""confidence"": 0.85, ""domain_weight"": 1.5, ""reliability_mult"": 1.0, ""staleness_weight"": 1.0, ""age_hours"": 0.0, ""final_weight"": 0.38, ""contribution"": 0.0}, {""agent"": ""technical"", ""direction"": ""NEUTRAL"", ""confidence"": 0.65, ""domain_weight"": 1.0499999999999998, ""reliability_mult"": 1.0, ""staleness_weight"": 1.0, ""age_hours"": 0.0, ""final_weight"": 1.05, ""contribution"": 0.0}, {""agent"": ""volatility"", ""direction"": ""BEARISH"", ""confidence"": 0.9, ""domain_weight"": 2.25, ""reliability_mult"": 1.0, ""staleness_weight"": 1.0, ""age_hours"": 0.0, ""final_weight"": 1.74, ""contribution"": -1.569}]",agronomist,-0.3924,scheduled,PROVEN,Record Brazilian coffee harvest anticipated at 66.2 million bags (+17.2%),1.0,"The bull argument that speculative capitulation and technical oversold conditions might indicate a short-term rally. However, these factors do not counterbalance the strong bearish supply forecast, making long-term bullish conditions unlikely."
