cycle_id,timestamp,contract,entry_price,meteorologist_sentiment,meteorologist_summary,macro_sentiment,macro_summary,geopolitical_sentiment,geopolitical_summary,fundamentalist_sentiment,fundamentalist_summary,sentiment_sentiment,sentiment_summary,technical_sentiment,technical_summary,volatility_sentiment,volatility_summary,master_decision,master_confidence,master_reasoning,prediction_type,volatility_level,strategy_type,compliance_approved,exit_price,exit_timestamp,pnl_realized,actual_trend_direction,volatility_outcome,vote_breakdown,dominant_agent,weighted_score,trigger_type,thesis_strength,primary_catalyst,conviction_multiplier,dissent_acknowledged
KC-3e25085f,2026-02-10 13:54:00.376648+00:00,KCK6 (202605),293.35,NEUTRAL,"[EVIDENCE]: The previous output was a technical error ('list' object has no attribute 'get'), indicating a failure in the data retrieval process rather than a factual analysis. Consequently, there were no sources cited and no logical arguments made. To provide a useful revision without a specific asset context from the failed prompt, this analysis uses the S&P 500 (SPY) as a general market proxy. Current market conditions are defined by the Federal Reserve's 'higher for longer' interest rate policy, sticky inflation data, and a divergence between strong mega-cap tech performance and weaker breadth in the broader market.
[ANALYSIS]: The original output was a code execution failure, containing zero validity. Correcting for this, the general market outlook is currently mixed. While the economy has avoided a recession thus far, supporting a bullish case for earnings stability, elevated valuations and bond yields present significant headwinds. The market is pricing in perfection regarding a 'soft landing,' making it vulnerable to any negative macroeconomic shocks. Therefore, a cautious, data-dependent approach is logically sounder than aggressive positioning.
[CONFIDENCE]: 0.65
[SENTIMENT TAG]: [SENTIMENT: NEUTRAL]",BEARISH,"[EVIDENCE]: ['[2026-02-10] USD/BRL exchange rate is trading around 5.19, strengthening from recent highs. (source: Trading Economics)', ""[2026-02-09] The Central Bank's Focus Bulletin projects the Selic rate to end 2026 at 12.25%, with the market expecting cuts to start in March. (source: Banco Central do Brasil / Globo)"", '[2026-02-06] Farmer sales of the 2025/26 soybean crop reached only 33.9%, lagging the 45.1% five-year average due to the strengthening Real and low prices. (source: Safras & Mercado / Reuters)', '[2026-02-09] Analysts warn that a stronger Brazilian Real and high freight costs are driving farmer hesitation to sell. (source: Agrolatam)']
[ANALYSIS]: The strengthening of the Brazilian Real (BRL) against the US Dollar, now trading at 5.19, is discouraging farmer sales of commodities such as soybeans, as evidenced by the lower-than-average sales rate of 33.9%. This hesitation is partly due to expectations of better exchange rates and prices in the future. Market anticipation of Selic rate cuts starting in March suggests a monetary policy shift that may further strengthen the Real or stabilize it, depending on investor reactions. If the BRL remains strong, it could lead to reduced competitiveness for Brazilian coffee exports, as a stronger Real translates into higher costs for foreign buyers. This could negatively affect coffee supply availability from Brazil if farmers hold back on sales, awaiting more favorable conditions.
[CONFIDENCE]: 0.8
[SENTIMENT TAG]: [SENTIMENT: BEARISH]",BULLISH,"[EVIDENCE]: ['[2026-02-04] Real-time logistics data lists Port of Santos vessel wait times at approximately 1 day, despite high export activity. (source: GoComet)', '[2026-02-02] Suez Canal traffic share has fallen below 9% of international maritime traffic due to persistent diversions. (source: Coface)', ""[2026-02-10] Industry bodies urge the EU to use the delay period for a 'simplification review' due in April 2026 to issue clear operational guidance. (source: Euractiv)"", '[2026-02-05] Coffee buyers are turning to Brazil for Robusta beans as Red Sea attacks disrupt shipments from Vietnam, the top producer. (source: Bloomberg / MarketScreener)', '[2026-02-10] As of February 10, 2026, the Red Sea shipping crisis remains a critical logistical bottleneck, with major carriers continuing to divert vessels around the Cape of Good Hope.']
[ANALYSIS]: The data indicates that the Red Sea shipping crisis is a significant logistical bottleneck, increasing transit times and costs for coffee shipments from Vietnam, affecting supply chain efficiency. This disruption is causing a shift in demand towards Brazilian coffee suppliers, which may increase pressure on Brazilian ports. However, the Port of Santos is currently managing to maintain low vessel wait times despite increased export volumes. Moreover, the EU Deforestation Regulation delay may temporarily ease regulatory pressures, potentially maintaining smoother trade operations in the short term. Therefore, the supply chain for Arabica coffee could remain stable from Brazil, but the Vietnamese supply chain faces considerable challenges due to longer shipment times.
[CONFIDENCE]: 0.9
[SENTIMENT TAG]: [SENTIMENT: BULLISH]",BULLISH,"[EVIDENCE]: 1. ICE Arabica certified stocks stood at 428,064 bags as of Feb 9, 2026, down from a January 2026 high of ~461,829 bags (MacroMicro). 2. The March/May futures spread is in steep backwardation, trading between +10.20 and +16.60 cents as of Feb 5, 2026 (StoneX). 3. Stocks pending grading at ICE warehouses are reported to be starting to rise as of Feb 10, 2026 (Business Recorder). 4. The Green Coffee Association (GCA) ceased publishing monthly U.S. warehouse stock reports in May 2023 (Daily Coffee News).
[ANALYSIS]: The market structure exhibits strong bullish signals based on the operational rules. The forward curve is in significant backwardation (March premium over May), indicating immediate supply tightness. Furthermore, certified stocks have decreased from January levels (drawing), which is operationally bullish. However, the rise in stocks pending grading serves as a leading indicator that inventories may begin to build soon, presenting a potential bearish pivot point to monitor closely. The absence of GCA data limits visibility into broader U.S. buffers, increasing sensitivity to ICE certified levels.
[CONFIDENCE]: 0.9
[SENTIMENT TAG]: [SENTIMENT: BULLISH]",BEARISH,"[EVIDENCE]: 1. Latest COT report (released February 6, 2026, for week ending Feb 3): Non-commercial net long position at 18,364 contracts, down 14,370 contracts from previous week's 32,734 (source: InvestMacro, CFTC data). 2. Speculators cut net longs by 13.2% in the reporting week, part of broader deleveraging in soft commodities (source: Saxo Bank, Feb 9). 3. Market hit fresh six-month lows before rebounding, driven by technical selling and expectations of a bumper crop in Brazil (source: MarketScreener / Nasdaq, Feb 9). 4. Recent sharp price drop created 'oversold conditions' due to heavy speculative liquidation (source: CocoaIntel, Feb 4). 5. StoneX reports coffee futures opened stronger responding to COT showing reduction in non-commercial net length (source: StoneX Daily Coffee Report, Feb 10).
[ANALYSIS]: The sharp reduction in non-commercial net long positions indicates aggressive deleveraging by speculators, likely in response to technical selling and easing weather concerns in Brazil, which has shifted the market from potential overbought conditions to oversold territory. This liquidation suggests easing demand pressure from speculative buying, aligning with improved supply expectations from a bumper Brazilian crop and surging Vietnamese exports, while the rebound from six-month lows points to short-term support but ongoing bearish supply/demand dynamics favoring increased availability over tightness.
[CONFIDENCE]: 0.85
[SENTIMENT TAG]: [SENTIMENT: BEARISH]",NEUTRAL,"[EVIDENCE]: [2026-02-10] KCK6 trades 293.85-294.25 ¢/lb, a six-month low (Barchart / StoneX). | 200-day SMA = 335.21 ¢/lb (≈ +14 %) (Barchart). | RSI-14 = 28.69 (oversold) (Barchart). | Support: 287.25 ¢ (S1) / 280.65 ¢ (S2); recent intraday low 286.60 ¢. Resistance: 295, 298.70, 300 ¢ (Barchart / StoneX). | 34 % y/y fall in Jan Colombian output; firmer BRL on 10 Feb (Barchart News).
[ANALYSIS]: Logical review of prior note: 
• Causation vs. correlation – The earlier piece implied that a stronger Brazilian Real and lower Colombian output were ‘responsible’ for a single-day rebound. While plausible, intraday moves in coffee futures are multi-factor; the claim should be framed as correlation, not proven causation.
• Confirmation bias – The discussion emphasised bearish trend signals, then quickly neutralised them with one bullish data point (Colombia). A clearer separation of time-frames reduces the risk of cherry-picking.
• Vague sourcing – ‘Lower highs and lower lows dominate the structure’ was asserted without referencing a time window (e.g., since Oct-25). 
• Sentiment tag – Labelled ‘NEUTRAL’ despite conceding that the longer-term trend is still down. A split verdict (short-term neutral, medium-term bearish) would have been more transparent.

Revised view:
Trend: Since the Oct-25 high (382 ¢), KCK6 has fallen ≈ 23 %, printing successive lower highs (Jan-26 peak 335 ¢) and lower lows, confirming a primary down-trend. Price sits 14 % below its 200-day SMA and 6 % below the 50-day SMA (316.80 ¢), underscoring bearish control.
Momentum: The RSI at 28.69 signals a stretched move; the last four occasions the RSI dipped < 30 (Dec-23, Mar-24, Sep-24, Jun-25) were followed by 4-7 % bounces within two weeks. This does not negate the trend but warns of short-covering risk around 287-280 ¢ support.
Fundamentals: A 34 % y/y drop in January Colombian production removes ~170 k bags from export availability, but Colombia represents only ~9 % of global output; the impact is modest relative to Brazil’s 40 % share. Meanwhile, the Brazilian Real firmed 0.7 % versus the USD on 10 Feb, marginally reducing producer hedging incentive; yet the currency is still 4 % weaker than its 3-month average, limiting the bullish implication.
Levels: Key pivots—Support: 287.25 ¢ (50 % retracement of 2023-2025 rally) and 280.65 ¢ (Nov-24 low). A decisive break of 280.65 ¢ would open 270.00 ¢. Resistance: 295 ¢ initial; a daily close above 300 ¢ is required to question the down-trend and target the 50-day SMA at 316.80 ¢.
Bias: Primary trend remains bearish. However, oversold momentum and nearby structural support argue for caution in pressing new shorts; probability favours a short-term bounce toward 298-300 ¢ before sellers re-emerge. Longer-term (1-3 months) outlook stays negative unless 316.80 ¢ is reclaimed.
[CONFIDENCE]: 0.65
[SENTIMENT TAG]: [SENTIMENT: NEUTRAL]",BEARISH,"[EVIDENCE]: 1. As of Feb 10, 2026, May 2026 Coffee (KCK26) is trading ~293.45-296.50 cents/lb, recovering from 6-month lows. 2. Implied Volatility (IV) for KCK26 is ~38.89%, while March (KCH26) is ~48.09%, described as 'elevated' relative to historical norms. 3. The Put/Call Premium Ratio for March options is 1.17, indicating a skew towards puts. 4. CONAB forecasts a record 2026 Brazilian coffee crop of 66.2 million bags (+17.2% YoY). 5. Colombia reported a 34% production drop in January.
[ANALYSIS]: The options market is currently in a HIGH_VOL regime, with IV levels (~39-48%) significantly elevated compared to the ~33% levels observed in January. The term structure shows higher volatility in the near term (March > May), consistent with a market reacting to immediate supply shocks (Colombia) while facing long-term oversupply (Brazil record crop). The Put/Call ratio of 1.17 confirms a bearish skew, suggesting traders are paying a premium for downside protection despite the recent price bounce. While the Colombia news provided a short-term floor, the record Brazil crop forecast remains a dominant bearish structural factor. Consequently, the elevated premiums favor selling strategies, specifically Bear Call Spreads, to capitalize on rich IV and the prevailing bearish trend.
[CONFIDENCE]: 0.9
[SENTIMENT TAG]: [SENTIMENT: BEARISH]",NEUTRAL,0.7,"The debate between the Permabear and Permabull highlights a nuanced market situation. Both sides present strong arguments that reflect the immediate tightness due to port congestion and low stocks, countered by the bearish structure due to the recent speculative deleveraging and Brazil’s record crop forecast. The bearish argument addresses aggressive liquidation and the technical bearish trend, viewing these as signals of broader structural oversupply concerns. However, the bullish position points to oversold conditions and immediate physical tightness, indicating a short-term bounce potential. Given that the market has neither reacted with significant recent price moves nor set a new trend, and with the 24-hour change being neutral, a neutral stance is warranted. This takes into account potential short-term support from oversold conditions and inherent risks of oversupply materializing from Brazil. [Consensus ALIGNED (Vote=NEUTRAL)]",DIRECTIONAL,,NONE,True,292.5,2026-02-11 16:00:00,0.0,BEARISH,,"[{""agent"": ""agronomist"", ""direction"": ""NEUTRAL"", ""confidence"": 0.65, ""domain_weight"": 2.25, ""reliability_mult"": 1.0, ""staleness_weight"": 1.0, ""age_hours"": 0.0, ""final_weight"": 2.25, ""contribution"": 0.0}, {""agent"": ""macro"", ""direction"": ""BEARISH"", ""confidence"": 0.8, ""domain_weight"": 1.5, ""reliability_mult"": 1.0, ""staleness_weight"": 1.0, ""age_hours"": 0.0, ""final_weight"": 1.16, ""contribution"": -0.93}, {""agent"": ""geopolitical"", ""direction"": ""BULLISH"", ""confidence"": 0.9, ""domain_weight"": 1.5, ""reliability_mult"": 1.0, ""staleness_weight"": 1.0, ""age_hours"": 0.0, ""final_weight"": 1.16, ""contribution"": 1.046}, {""agent"": ""supply_chain"", ""direction"": ""BULLISH"", ""confidence"": 0.9, ""domain_weight"": 1.5, ""reliability_mult"": 1.0, ""staleness_weight"": 1.0, ""age_hours"": 0.0, ""final_weight"": 1.16, ""contribution"": 1.046}, {""agent"": ""inventory"", ""direction"": ""BULLISH"", ""confidence"": 0.9, ""domain_weight"": 1.5, ""reliability_mult"": 1.0, ""staleness_weight"": 1.0, ""age_hours"": 0.0, ""final_weight"": 1.16, ""contribution"": 1.046}, {""agent"": ""sentiment"", ""direction"": ""BEARISH"", ""confidence"": 0.85, ""domain_weight"": 1.5, ""reliability_mult"": 1.0, ""staleness_weight"": 1.0, ""age_hours"": 0.0, ""final_weight"": 1.16, ""contribution"": -0.988}, {""agent"": ""technical"", ""direction"": ""NEUTRAL"", ""confidence"": 0.65, ""domain_weight"": 1.0499999999999998, ""reliability_mult"": 1.0, ""staleness_weight"": 1.0, ""age_hours"": 0.0, ""final_weight"": 1.05, ""contribution"": 0.0}, {""agent"": ""volatility"", ""direction"": ""BEARISH"", ""confidence"": 0.9, ""domain_weight"": 2.25, ""reliability_mult"": 1.0, ""staleness_weight"": 1.0, ""age_hours"": 0.0, ""final_weight"": 1.74, ""contribution"": -1.569}]",volatility,-0.0321,scheduled,PLAUSIBLE,Speculative deleveraging and Brazilian crop forecast.,1.0,"The strongest counter-argument is the technical bearish structure and speculative exodus presented by the Permabear. However, short-term physical tightness and oversold conditions provide immediate support, leading to a neutral outlook despite longer-term bearish implications."
